{"schema_version": 1, "id": "countertide", "title": "逆潮档案", "entries": [{"id": "ch_arrival", "kind": "chapter", "title": "逆潮来信", "target_ref": {"kind": "event", "id": "arrival"}, "status": "draft"}, {"id": "ch_tower", "kind": "chapter", "title": "未写出的证词", "target_ref": {"kind": "event", "id": "tower"}, "status": "draft"}, {"id": "ch_preserve", "kind": "chapter", "title": "留下证词", "target_ref": {"kind": "event", "id": "preserve"}, "status": "draft"}, {"id": "ch_submit", "kind": "chapter", "title": "烧毁之前", "target_ref": {"kind": "event", "id": "submit"}, "status": "draft"}, {"id": "ch_retreat", "kind": "chapter", "title": "回到港城", "target_ref": {"kind": "event", "id": "retreat"}, "status": "draft"}]}