{
  "schema_version": 1,
  "id": "blue_hour",
  "title": "蓝时水库 · 合作者审稿",
  "entries": [
    {
      "id": "arrival",
      "kind": "chapter",
      "title": "最后一班渡船",
      "target_ref": {
        "kind": "event",
        "id": "arrival"
      }
    },
    {
      "id": "crossing",
      "kind": "chapter",
      "title": "穿过空海床",
      "target_ref": {
        "kind": "event",
        "id": "crossing"
      }
    },
    {
      "id": "reunion",
      "kind": "chapter",
      "title": "三封信",
      "target_ref": {
        "kind": "event",
        "id": "reunion"
      }
    }
  ]
}
